{
  "$schema": "./hooks-config.schema.json",
  "version": "1.0.0",
  "projectType": "javascript",
  "testCommand": "npm test",
  "unitTestCommand": "npm run test:unit",
  "formatCommand": "npm run format",
  "lintCommand": "npm run lint",
  "protectedBranches": ["main", "master", "develop", "release/*", "hotfix/*"],
  "skipDocsOnlyChanges": true,
  "docsPatterns": ["*.md", "*.txt", "docs/*", "README*", "LICENSE*", "CHANGELOG*"],
  "enableCommitMsgValidation": false,
  "bypassEnvVar": "WINGMAN_SKIP_HOOKS",
  "pattern": "A"
}
